<?xml version="1.0" encoding="UTF-8"?>
<!DOCTYPE JobConfiguration PUBLIC "" "/afs/desy.de/user/a/albrechs/xxl/af-cms/UHH2/10_2/CMSSW_10_2_10/src/UHH2/JetMass/config/VqqJetsJobConfig.dtd" [
<!ENTITY NEVT "-1">
<!ENTITY OUTdir   "/nfs/dust/cms/user/albrechs/UHH2/JetMassOutput/WJetsTrees/scaleStudy/">
<!ENTITY SAMPLES SYSTEM "Vqq_jets_samples.xml">
]>

<!--
<ConfigParse NEventsBreak="0" LastBreak="0" FileSplit="40"/>
<ConfigSGE RAM="4" DISK="4" Mail="steffen.albrecht@desy.de" Notification="as" Workdir="workdir_Vqq_scaleStudy"/>
-->

<JobConfiguration JobName="VqqJetsScaleStudyJob" OutputLevel="INFO">
  <Library Name="libSUHH2JetMass"/>
  <Package Name="SUHH2JetMass.par"/>

  <Cycle Name="uhh2::AnalysisModuleRunner" OutputDirectory="&OUTdir;/oneScale/" PostFix="" TargetLumi="41860">
    &SAMPLES;
    <UserConfig>
      <Item Name="GridFile" Value="JetMass/Histograms/grid_oneScale.root" />
      <Item Name="channel" Value="W"/>
      <Item Name="PrimaryVertexCollection" Value="offlineSlimmedPrimaryVertices"/>
      <Item Name="GenParticleCollection"   Value="GenParticles"/>
      <Item Name="ElectronCollection"      Value="slimmedElectronsUSER"/>
      <Item Name="MuonCollection"          Value="slimmedMuonsUSER"/>
      <Item Name="JetCollection"           Value="jetsAk4CHS"/>
      <Item Name="GenJetCollection"        Value="slimmedGenJets"/>
      <Item Name="TopJetCollection"        Value="jetsAk8PuppiSubstructure_SoftDropPuppi"/>
      <Item Name="GenTopJetCollection"     Value="genjetsAk8SubstructureSoftDrop" />
      <Item Name="PFParticleCollection"    Value="PFParticles"/>
      <Item Name="METName"                 Value="slimmedMETs"/>
      <Item Name="use_sframe_weight" Value="false"/>
      <Item Name="dometfilters" Value="true" />
      <Item Name="dopvfilter" Value="true" />
      <Item Name="doSpikeKiller" Value="true" />
      <Item Name="lumi_file" Value="common/data/2017/Cert_294927-306462_13TeV_EOY2017ReReco_Collisions17_JSON_v1.root"/>
      <Item Name="NLOweightsDir" Value="UHHNtupleConverter/NLOweights"/>
      <Item Name="pileup_directory_data" Value="common/data/2017/MyDataPileupHistogram.root" />
      <Item Name="pileup_directory" Value="common/data/2017/MyMCPileupHistogram.root" />
      <Item Name="AnalysisModule" Value="PreSelModule"/>
    </UserConfig>
  </Cycle>

  <Cycle Name="uhh2::AnalysisModuleRunner" OutputDirectory="&OUTdir;/PF_flavours/" PostFix="" TargetLumi="41860">
    &SAMPLES;
    <UserConfig>
      <Item Name="GridFile" Value="JetMass/Histograms/grid_PF_flavours.root" />
      <Item Name="channel" Value="W"/>
      <Item Name="PrimaryVertexCollection" Value="offlineSlimmedPrimaryVertices"/>
      <Item Name="GenParticleCollection"   Value="GenParticles"/>
      <Item Name="ElectronCollection"      Value="slimmedElectronsUSER"/>
      <Item Name="MuonCollection"          Value="slimmedMuonsUSER"/>
      <Item Name="JetCollection"           Value="jetsAk4CHS"/>
      <Item Name="GenJetCollection"        Value="slimmedGenJets"/>
      <Item Name="TopJetCollection"        Value="jetsAk8PuppiSubstructure_SoftDropPuppi"/>
      <Item Name="GenTopJetCollection"     Value="genjetsAk8SubstructureSoftDrop" />
      <Item Name="PFParticleCollection"    Value="PFParticles"/>
      <Item Name="METName"                 Value="slimmedMETs"/>
      <Item Name="use_sframe_weight" Value="false"/>
      <Item Name="dometfilters" Value="true" />
      <Item Name="dopvfilter" Value="true" />
      <Item Name="doSpikeKiller" Value="true" />
      <Item Name="lumi_file" Value="common/data/2017/Cert_294927-306462_13TeV_EOY2017ReReco_Collisions17_JSON_v1.root"/>
      <Item Name="NLOweightsDir" Value="UHHNtupleConverter/NLOweights"/>
      <Item Name="pileup_directory_data" Value="common/data/2017/MyDataPileupHistogram.root" />
      <Item Name="pileup_directory" Value="common/data/2017/MyMCPileupHistogram.root" />
      <Item Name="AnalysisModule" Value="PreSelModule"/>
    </UserConfig>
  </Cycle>


  <Cycle Name="uhh2::AnalysisModuleRunner" OutputDirectory="&OUTdir;/2ptbins/" PostFix="" TargetLumi="41860">
    &SAMPLES;
    <UserConfig>
      <Item Name="GridFile" Value="JetMass/Histograms/grid_2ptbins.root" />
      <Item Name="channel" Value="W"/>
      <Item Name="PrimaryVertexCollection" Value="offlineSlimmedPrimaryVertices"/>
      <Item Name="GenParticleCollection"   Value="GenParticles"/>
      <Item Name="ElectronCollection"      Value="slimmedElectronsUSER"/>
      <Item Name="MuonCollection"          Value="slimmedMuonsUSER"/>
      <Item Name="JetCollection"           Value="jetsAk4CHS"/>
      <Item Name="GenJetCollection"        Value="slimmedGenJets"/>
      <Item Name="TopJetCollection"        Value="jetsAk8PuppiSubstructure_SoftDropPuppi"/>
      <Item Name="GenTopJetCollection"     Value="genjetsAk8SubstructureSoftDrop" />
      <Item Name="PFParticleCollection"    Value="PFParticles"/>
      <Item Name="METName"                 Value="slimmedMETs"/>
      <Item Name="use_sframe_weight" Value="false"/>
      <Item Name="dometfilters" Value="true" />
      <Item Name="dopvfilter" Value="true" />
      <Item Name="doSpikeKiller" Value="true" />
      <Item Name="lumi_file" Value="common/data/2017/Cert_294927-306462_13TeV_EOY2017ReReco_Collisions17_JSON_v1.root"/>
      <Item Name="NLOweightsDir" Value="UHHNtupleConverter/NLOweights"/>
      <Item Name="pileup_directory_data" Value="common/data/2017/MyDataPileupHistogram.root" />
      <Item Name="pileup_directory" Value="common/data/2017/MyMCPileupHistogram.root" />
      <Item Name="AnalysisModule" Value="PreSelModule"/>
    </UserConfig>
  </Cycle>


  <Cycle Name="uhh2::AnalysisModuleRunner" OutputDirectory="&OUTdir;/2etabins/" PostFix="" TargetLumi="41860">
    &SAMPLES;
    <UserConfig>
      <Item Name="GridFile" Value="JetMass/Histograms/grid_2etabins.root" />
      <Item Name="channel" Value="W"/>
      <Item Name="PrimaryVertexCollection" Value="offlineSlimmedPrimaryVertices"/>
      <Item Name="GenParticleCollection"   Value="GenParticles"/>
      <Item Name="ElectronCollection"      Value="slimmedElectronsUSER"/>
      <Item Name="MuonCollection"          Value="slimmedMuonsUSER"/>
      <Item Name="JetCollection"           Value="jetsAk4CHS"/>
      <Item Name="GenJetCollection"        Value="slimmedGenJets"/>
      <Item Name="TopJetCollection"        Value="jetsAk8PuppiSubstructure_SoftDropPuppi"/>
      <Item Name="GenTopJetCollection"     Value="genjetsAk8SubstructureSoftDrop" />
      <Item Name="PFParticleCollection"    Value="PFParticles"/>
      <Item Name="METName"                 Value="slimmedMETs"/>
      <Item Name="use_sframe_weight" Value="false"/>
      <Item Name="dometfilters" Value="true" />
      <Item Name="dopvfilter" Value="true" />
      <Item Name="doSpikeKiller" Value="true" />
      <Item Name="lumi_file" Value="common/data/2017/Cert_294927-306462_13TeV_EOY2017ReReco_Collisions17_JSON_v1.root"/>
      <Item Name="NLOweightsDir" Value="UHHNtupleConverter/NLOweights"/>
      <Item Name="pileup_directory_data" Value="common/data/2017/MyDataPileupHistogram.root" />
      <Item Name="pileup_directory" Value="common/data/2017/MyMCPileupHistogram.root" />
      <Item Name="AnalysisModule" Value="PreSelModule"/>
    </UserConfig>
  </Cycle>


  <Cycle Name="uhh2::AnalysisModuleRunner" OutputDirectory="&OUTdir;/PF_flavours_2ptbins/" PostFix="" TargetLumi="41860">
    &SAMPLES;
    <UserConfig>
      <Item Name="GridFile" Value="JetMass/Histograms/grid_PF_flavours_2ptbins.root" />
      <Item Name="channel" Value="W"/>
      <Item Name="PrimaryVertexCollection" Value="offlineSlimmedPrimaryVertices"/>
      <Item Name="GenParticleCollection"   Value="GenParticles"/>
      <Item Name="ElectronCollection"      Value="slimmedElectronsUSER"/>
      <Item Name="MuonCollection"          Value="slimmedMuonsUSER"/>
      <Item Name="JetCollection"           Value="jetsAk4CHS"/>
      <Item Name="GenJetCollection"        Value="slimmedGenJets"/>
      <Item Name="TopJetCollection"        Value="jetsAk8PuppiSubstructure_SoftDropPuppi"/>
      <Item Name="GenTopJetCollection"     Value="genjetsAk8SubstructureSoftDrop" />
      <Item Name="PFParticleCollection"    Value="PFParticles"/>
      <Item Name="METName"                 Value="slimmedMETs"/>
      <Item Name="use_sframe_weight" Value="false"/>
      <Item Name="dometfilters" Value="true" />
      <Item Name="dopvfilter" Value="true" />
      <Item Name="doSpikeKiller" Value="true" />
      <Item Name="lumi_file" Value="common/data/2017/Cert_294927-306462_13TeV_EOY2017ReReco_Collisions17_JSON_v1.root"/>
      <Item Name="NLOweightsDir" Value="UHHNtupleConverter/NLOweights"/>
      <Item Name="pileup_directory_data" Value="common/data/2017/MyDataPileupHistogram.root" />
      <Item Name="pileup_directory" Value="common/data/2017/MyMCPileupHistogram.root" />
      <Item Name="AnalysisModule" Value="PreSelModule"/>
    </UserConfig>
  </Cycle>

  <Cycle Name="uhh2::AnalysisModuleRunner" OutputDirectory="&OUTdir;/PF_flavours_2etabins/" PostFix="" TargetLumi="41860">
    &SAMPLES;
    <UserConfig>
      <Item Name="GridFile" Value="JetMass/Histograms/grid_PF_flavours_2etabins.root" />
      <Item Name="channel" Value="W"/>
      <Item Name="PrimaryVertexCollection" Value="offlineSlimmedPrimaryVertices"/>
      <Item Name="GenParticleCollection"   Value="GenParticles"/>
      <Item Name="ElectronCollection"      Value="slimmedElectronsUSER"/>
      <Item Name="MuonCollection"          Value="slimmedMuonsUSER"/>
      <Item Name="JetCollection"           Value="jetsAk4CHS"/>
      <Item Name="GenJetCollection"        Value="slimmedGenJets"/>
      <Item Name="TopJetCollection"        Value="jetsAk8PuppiSubstructure_SoftDropPuppi"/>
      <Item Name="GenTopJetCollection"     Value="genjetsAk8SubstructureSoftDrop" />
      <Item Name="PFParticleCollection"    Value="PFParticles"/>
      <Item Name="METName"                 Value="slimmedMETs"/>